{
  "schema_version": 1,
  "runtime": "GNU Octave 11.3.0",
  "response_values_or_statistics_released": false,
  "native_models_fitted_or_scored": false,
  "response_projections_written": false,
  "cases": [
    {
      "source_group_id": "1b38366b-7473-4ddf-9cf9-26e625533686:/rep1",
      "target_group_id": "721ef5f2-b858-4257-8cc8-5eea9a8599bb:/sfp1/gluc/rep1",
      "variant_id": "deposited_nucLoc_source_normalizer_only",
      "known_duplicate_control": false,
      "replay_completed": true,
      "same_central_window_shape": false,
      "exact_double_equality": false,
      "exact_source_decimal_token_equality": false
    },
    {
      "source_group_id": "1b38366b-7473-4ddf-9cf9-26e625533686:/rep1",
      "target_group_id": "721ef5f2-b858-4257-8cc8-5eea9a8599bb:/sfp1/gluc/rep2",
      "variant_id": "deposited_nucLoc_source_normalizer_only",
      "known_duplicate_control": false,
      "replay_completed": true,
      "same_central_window_shape": false,
      "exact_double_equality": false,
      "exact_source_decimal_token_equality": false
    },
    {
      "source_group_id": "1b38366b-7473-4ddf-9cf9-26e625533686:/rep1",
      "target_group_id": "721ef5f2-b858-4257-8cc8-5eea9a8599bb:/sfp1/gluc/rep1",
      "variant_id": "recomputed_ratio_source_normalizer_only",
      "known_duplicate_control": false,
      "replay_completed": true,
      "same_central_window_shape": false,
      "exact_double_equality": false,
      "exact_source_decimal_token_equality": false
    },
    {
      "source_group_id": "1b38366b-7473-4ddf-9cf9-26e625533686:/rep1",
      "target_group_id": "721ef5f2-b858-4257-8cc8-5eea9a8599bb:/sfp1/gluc/rep2",
      "variant_id": "recomputed_ratio_source_normalizer_only",
      "known_duplicate_control": false,
      "replay_completed": true,
      "same_central_window_shape": false,
      "exact_double_equality": false,
      "exact_source_decimal_token_equality": false
    },
    {
      "source_group_id": "1b38366b-7473-4ddf-9cf9-26e625533686:/rep1",
      "target_group_id": "721ef5f2-b858-4257-8cc8-5eea9a8599bb:/sfp1/gluc/rep1",
      "variant_id": "deposited_nucLoc_worked_example",
      "known_duplicate_control": false,
      "replay_completed": true,
      "same_central_window_shape": false,
      "exact_double_equality": false,
      "exact_source_decimal_token_equality": false
    },
    {
      "source_group_id": "1b38366b-7473-4ddf-9cf9-26e625533686:/rep1",
      "target_group_id": "721ef5f2-b858-4257-8cc8-5eea9a8599bb:/sfp1/gluc/rep2",
      "variant_id": "deposited_nucLoc_worked_example",
      "known_duplicate_control": false,
      "replay_completed": true,
      "same_central_window_shape": false,
      "exact_double_equality": false,
      "exact_source_decimal_token_equality": false
    },
    {
      "source_group_id": "1b38366b-7473-4ddf-9cf9-26e625533686:/rep1",
      "target_group_id": "721ef5f2-b858-4257-8cc8-5eea9a8599bb:/sfp1/gluc/rep1",
      "variant_id": "recomputed_ratio_worked_example",
      "known_duplicate_control": false,
      "replay_completed": true,
      "same_central_window_shape": false,
      "exact_double_equality": false,
      "exact_source_decimal_token_equality": false
    },
    {
      "source_group_id": "1b38366b-7473-4ddf-9cf9-26e625533686:/rep1",
      "target_group_id": "721ef5f2-b858-4257-8cc8-5eea9a8599bb:/sfp1/gluc/rep2",
      "variant_id": "recomputed_ratio_worked_example",
      "known_duplicate_control": false,
      "replay_completed": true,
      "same_central_window_shape": false,
      "exact_double_equality": false,
      "exact_source_decimal_token_equality": false
    },
    {
      "source_group_id": "1b38366b-7473-4ddf-9cf9-26e625533686:/rep2",
      "target_group_id": "721ef5f2-b858-4257-8cc8-5eea9a8599bb:/sfp1/gluc/rep1",
      "variant_id": "deposited_nucLoc_source_normalizer_only",
      "known_duplicate_control": false,
      "replay_completed": true,
      "same_central_window_shape": false,
      "exact_double_equality": false,
      "exact_source_decimal_token_equality": false
    },
    {
      "source_group_id": "1b38366b-7473-4ddf-9cf9-26e625533686:/rep2",
      "target_group_id": "721ef5f2-b858-4257-8cc8-5eea9a8599bb:/sfp1/gluc/rep2",
      "variant_id": "deposited_nucLoc_source_normalizer_only",
      "known_duplicate_control": false,
      "replay_completed": true,
      "same_central_window_shape": false,
      "exact_double_equality": false,
      "exact_source_decimal_token_equality": false
    },
    {
      "source_group_id": "1b38366b-7473-4ddf-9cf9-26e625533686:/rep2",
      "target_group_id": "721ef5f2-b858-4257-8cc8-5eea9a8599bb:/sfp1/gluc/rep1",
      "variant_id": "recomputed_ratio_source_normalizer_only",
      "known_duplicate_control": false,
      "replay_completed": true,
      "same_central_window_shape": false,
      "exact_double_equality": false,
      "exact_source_decimal_token_equality": false
    },
    {
      "source_group_id": "1b38366b-7473-4ddf-9cf9-26e625533686:/rep2",
      "target_group_id": "721ef5f2-b858-4257-8cc8-5eea9a8599bb:/sfp1/gluc/rep2",
      "variant_id": "recomputed_ratio_source_normalizer_only",
      "known_duplicate_control": false,
      "replay_completed": true,
      "same_central_window_shape": false,
      "exact_double_equality": false,
      "exact_source_decimal_token_equality": false
    },
    {
      "source_group_id": "1b38366b-7473-4ddf-9cf9-26e625533686:/rep2",
      "target_group_id": "721ef5f2-b858-4257-8cc8-5eea9a8599bb:/sfp1/gluc/rep1",
      "variant_id": "deposited_nucLoc_worked_example",
      "known_duplicate_control": false,
      "replay_completed": true,
      "same_central_window_shape": false,
      "exact_double_equality": false,
      "exact_source_decimal_token_equality": false
    },
    {
      "source_group_id": "1b38366b-7473-4ddf-9cf9-26e625533686:/rep2",
      "target_group_id": "721ef5f2-b858-4257-8cc8-5eea9a8599bb:/sfp1/gluc/rep2",
      "variant_id": "deposited_nucLoc_worked_example",
      "known_duplicate_control": false,
      "replay_completed": true,
      "same_central_window_shape": false,
      "exact_double_equality": false,
      "exact_source_decimal_token_equality": false
    },
    {
      "source_group_id": "1b38366b-7473-4ddf-9cf9-26e625533686:/rep2",
      "target_group_id": "721ef5f2-b858-4257-8cc8-5eea9a8599bb:/sfp1/gluc/rep1",
      "variant_id": "recomputed_ratio_worked_example",
      "known_duplicate_control": false,
      "replay_completed": true,
      "same_central_window_shape": false,
      "exact_double_equality": false,
      "exact_source_decimal_token_equality": false
    },
    {
      "source_group_id": "1b38366b-7473-4ddf-9cf9-26e625533686:/rep2",
      "target_group_id": "721ef5f2-b858-4257-8cc8-5eea9a8599bb:/sfp1/gluc/rep2",
      "variant_id": "recomputed_ratio_worked_example",
      "known_duplicate_control": false,
      "replay_completed": true,
      "same_central_window_shape": false,
      "exact_double_equality": false,
      "exact_source_decimal_token_equality": false
    },
    {
      "source_group_id": "1b38366b-7473-4ddf-9cf9-26e625533686:/rep3",
      "target_group_id": "721ef5f2-b858-4257-8cc8-5eea9a8599bb:/sfp1/gluc/rep1",
      "variant_id": "deposited_nucLoc_source_normalizer_only",
      "known_duplicate_control": false,
      "replay_completed": true,
      "same_central_window_shape": false,
      "exact_double_equality": false,
      "exact_source_decimal_token_equality": false
    },
    {
      "source_group_id": "1b38366b-7473-4ddf-9cf9-26e625533686:/rep3",
      "target_group_id": "721ef5f2-b858-4257-8cc8-5eea9a8599bb:/sfp1/gluc/rep2",
      "variant_id": "deposited_nucLoc_source_normalizer_only",
      "known_duplicate_control": false,
      "replay_completed": true,
      "same_central_window_shape": false,
      "exact_double_equality": false,
      "exact_source_decimal_token_equality": false
    },
    {
      "source_group_id": "1b38366b-7473-4ddf-9cf9-26e625533686:/rep3",
      "target_group_id": "721ef5f2-b858-4257-8cc8-5eea9a8599bb:/sfp1/gluc/rep1",
      "variant_id": "recomputed_ratio_source_normalizer_only",
      "known_duplicate_control": false,
      "replay_completed": true,
      "same_central_window_shape": false,
      "exact_double_equality": false,
      "exact_source_decimal_token_equality": false
    },
    {
      "source_group_id": "1b38366b-7473-4ddf-9cf9-26e625533686:/rep3",
      "target_group_id": "721ef5f2-b858-4257-8cc8-5eea9a8599bb:/sfp1/gluc/rep2",
      "variant_id": "recomputed_ratio_source_normalizer_only",
      "known_duplicate_control": false,
      "replay_completed": true,
      "same_central_window_shape": false,
      "exact_double_equality": false,
      "exact_source_decimal_token_equality": false
    },
    {
      "source_group_id": "1b38366b-7473-4ddf-9cf9-26e625533686:/rep3",
      "target_group_id": "721ef5f2-b858-4257-8cc8-5eea9a8599bb:/sfp1/gluc/rep1",
      "variant_id": "deposited_nucLoc_worked_example",
      "known_duplicate_control": false,
      "replay_completed": true,
      "same_central_window_shape": false,
      "exact_double_equality": false,
      "exact_source_decimal_token_equality": false
    },
    {
      "source_group_id": "1b38366b-7473-4ddf-9cf9-26e625533686:/rep3",
      "target_group_id": "721ef5f2-b858-4257-8cc8-5eea9a8599bb:/sfp1/gluc/rep2",
      "variant_id": "deposited_nucLoc_worked_example",
      "known_duplicate_control": false,
      "replay_completed": true,
      "same_central_window_shape": false,
      "exact_double_equality": false,
      "exact_source_decimal_token_equality": false
    },
    {
      "source_group_id": "1b38366b-7473-4ddf-9cf9-26e625533686:/rep3",
      "target_group_id": "721ef5f2-b858-4257-8cc8-5eea9a8599bb:/sfp1/gluc/rep1",
      "variant_id": "recomputed_ratio_worked_example",
      "known_duplicate_control": false,
      "replay_completed": true,
      "same_central_window_shape": false,
      "exact_double_equality": false,